<?xml version="1.0" encoding="utf-8"?>
<!DOCTYPE resources SYSTEM "../map.dtd" []>
<resources>
  <author>
    <name>Anthony CARRÃ‰</name>
    <nickname>yeKcim</nickname>
    <email>yeknan AT yahoo DOT fr</email>
    <country>France</country>
  </author>

  <surface name="sky" file="sky.jpg" />
  <surface name="map" file="goodandevil.png" />
  <surface name="preview" file="preview.jpg" />

  <name>Good and Evil</name>
  <water>0</water>
  <nb_mine>5</nb_mine>
  <is_open>1</is_open>
  <!-- pad is given in pixel count. -->
  <add_pad>1</add_pad>
  <point name="upper_left_pad" x="1000" y="1000" />
  <point name="lower_right_pad" x="1000" y="0" />

</resources>
