<?xml version="1.0" encoding="utf-8"?>
<!DOCTYPE resources SYSTEM "../map.dtd" []>
<resources>
  <author>
    <name>Glenn ROLLAND</name>
    <nickname>Glenux</nickname>
    <email>glenux AT gmail.com</email>
    <country>France</country>
  </author>

  <surface name="sky" file="battlenight-bg.jpg" />
  <surface name="map" file="battlenight-fg.png" />
  <surface name="preview" file="battlenight-all.jpg" />

  <name>Battle Night</name>
  <water>0</water>
  <nb_mine>3</nb_mine>
  <is_open>1</is_open>
</resources>
